{
  "kind": "cineweave_codex_interactive_draft_brief",
  "contractVersion": "2.0.0",
  "worldId": "world-cloud-dynasty",
  "shotId": "scene-01-shot-04",
  "shotPurpose": "让女主第一次看见天宫时感到敬畏，而不是恐惧。",
  "primaryFocus": "远方天宫与作为尺度锚点的女主背影",
  "composition": "前景巨柱遮挡画面左侧；女主位于下方三分之一；天宫在上方远处，主体在横移后才完整显露。",
  "camera": "24mm，低于眼平，缓慢向右横移并轻微推进；揭示完成后稳定停留 1.5 秒。",
  "visualTreatment": "月白、石青、暖象牙和少量暗金；冷环境光与黄昏逆光；分层云雾和真实丝绸透光。",
  "preserve": [
    "女主的月白朱绫轮廓",
    "人物必须保持小比例作为尺度锚点",
    "天宫的高处远距位置"
  ],
  "allowedChanges": [
    "前景柱的遮挡宽度",
    "雾层密度"
  ],
  "negativeConstraints": [
    "不要第一帧完整展示天宫",
    "不要 Web 端或外部 SaaS 替代 Codex 的创作判断",
    "不要全局魔法发光、塑料材质或网游装饰"
  ],
  "importContract": {
    "source": "codex_interactive",
    "statusOnCreation": "draft",
    "requiredMedia": "用户必须导入真实 Codex 图片或由 Codex 返回的可验证媒体引用",
    "nextAction": "回到 CineWeave Director’s Palette，绑定 Draft 媒体并在评审后锁定 Keyframe"
  }
}
